{
  "commands": [
    "make ci-for-evidence (candidate gates; final make ci adds evidence self-binding)",
    "make spec",
    "python3 scripts/check_traceability_coverage.py",
    "RUSTDOCFLAGS=-Dwarnings cargo doc --no-deps --all-features",
    "cargo tree --no-default-features --edges normal",
    "git diff --check origin/main...91f69342585870711b6964491c9fe942347bd0ac",
    "python3 scripts/validate_json_schema.py INPUT_SCHEMA collection-input.json",
    "python3 scripts/validate_json_schema.py MANIFEST_SCHEMA evidence-manifest.json",
    "python3 scripts/validate_json_schema.py PGM01_SCHEMA evidence-envelope.json",
    "python3 PGM01_VALIDATOR --fixture evidence-envelope.json",
    "python3 scripts/build_evidence_envelope.py EVIDENCE_DIR final",
    "python3 scripts/validate_json_schema.py PGM01_SCHEMA finalized-evidence-envelope.json",
    "python3 PGM01_VALIDATOR --fixture finalized-evidence-envelope.json",
    "python3 scripts/finalize_collection.py EVIDENCE_DIR"
  ],
  "corpus": {
    "formulaSchema": {
      "digest": {
        "algorithm": "sha256",
        "value": "780c70055eb979a7913dc224e752d56f057793a0ef60af0e7270f53a4f973393"
      },
      "id": "tl-syntax.formula",
      "version": "v1"
    },
    "manifestDigest": {
      "algorithm": "sha256",
      "value": "3749850e9fbd5b69fc6d2df3385f1dd38e6235c056fecfc915f1a56f7c7b618e"
    },
    "propositionMapSchema": {
      "digest": {
        "algorithm": "sha256",
        "value": "ed5be5c2747db16f7936a94b6203bb2747a1abb5a0c5521c2efa38beb8dfdc80"
      },
      "id": "tl-syntax.proposition-map",
      "version": "v1"
    },
    "revision": "tl-syntax-corpus/v1"
  },
  "pgm01": {
    "candidateRevision": "7dac9d8c19952412b56a0347387666e2ca81e01d",
    "envelopeSchema": "quire.derivation-evidence/v1",
    "envelopeSchemaDigest": {
      "algorithm": "sha256",
      "value": "0946e235e9e4b0fa79e9b9ec27ae157b303c17de0a9408d3cc04968fb7152256"
    },
    "policy": "ix://agent-ix/quire-contract-ir/PGM-01"
  },
  "qualificationProfile": "tl-syntax.evidence-qualification/v2",
  "schemaVersion": "tl-syntax.evidence-input/v1",
  "sourceRevision": "91f69342585870711b6964491c9fe942347bd0ac",
  "sourceState": "clean",
  "tools": {
    "cargo": "cargo 1.94.1 (29ea6fb6a 2026-03-24)",
    "identities": {
      "bash": {
        "path": "/usr/bin/bash",
        "sha256": "59474588a312b6b6e73e5a42a59bf71e62b55416b6c9d5e4a6e1c630c2a9ecd4"
      },
      "cargo": {
        "path": "/home/peter/.rustup/toolchains/stable-x86_64-unknown-linux-gnu/bin/cargo",
        "sha256": "b7561ebe947acf816451536f19871ea4810f6be3f82fd252feab6ca7be8396f5"
      },
      "git": {
        "path": "/usr/bin/git",
        "sha256": "587ef21868c948b883993e23209b86a72a6ddc06aab1545c697ffc31075acd4a"
      },
      "make": {
        "path": "/usr/bin/make",
        "sha256": "92f646030615cd98490a68a94c0aefd87b552be3158b941c02e43b0bfdb576db"
      },
      "python3": {
        "path": "/usr/bin/python3",
        "sha256": "7d51cd6b48b521277f5caa4610a82126e315fa2be4df069823a8b1eeb5bd4a86"
      },
      "quire": {
        "path": "/home/peter/.npm-global/bin/quire",
        "sha256": "96ce25fe91ab75ee96505b343b251a3e1db16de430a524aabef1f5590dbc02b3"
      },
      "rustc": {
        "path": "/home/peter/.rustup/toolchains/stable-x86_64-unknown-linux-gnu/bin/rustc",
        "sha256": "ef6d716e5d1c6c93def277c0afa037c21e7a74f7de3aed4ee0700646c3301b1d"
      },
      "rustup": {
        "path": "/home/peter/.cargo/bin/rustup",
        "sha256": "4acc9acc76d5079515b46346a485974457b5a79893cfb01112423c89aeb5aa10"
      },
      "sha256sum": {
        "path": "/usr/bin/sha256sum",
        "sha256": "7645c8e76d75515ccb75c9086bdcf0d4071f2985f380f249253ead7d7c6810b3"
      }
    },
    "jsonschema": "3.2.0",
    "python": "Python 3.10.12",
    "quire": "0.31.0",
    "rustc": "rustc 1.94.1 (e408947bf 2026-03-25)"
  }
}
